Identifiant,Orig.,Norm.,Pages,Imprimeur,Titre bref,Auteur,Date,Lieu,Lien fac-similé numérique,Exemplaire, Notes
CRRJG01,gold,gold,64,[Jean Girard],Epistre tres utile envoyée à la Royne de Navarre,Marie Dentière,1539,[Genève],https://doi.org/10.3931/e-rara-12685,Genève MHR - MHR D Den 1,
CRRJG02,gold,à venir,271 (corriger?),[Jean Girard],Chrestienne resjouyssance,Eustorg de Beaulieu,1546,[Genève],https://onb.digital/result/109B2E78,Vienne NB - 80.M.74,Pages doubles à regler et numérotation bizarre
CRRJG03,gold,à venir,64,[Jean Girard],Chansons demonstrant les erreurs et abus du temps present,[Anonyme],1542,[Genève],https://onb.digital/result/109D02D0, Vienne NB - 80.X.38,
CRRJM01,gold,gold,64,[Jean Michel],Ordre et maniere qu'on tient en administrant les sainctz sacremens,[Guillaume Farel],1538,[Genève],https://doi.org/10.3931/e-rara-5896,Genève BGE - BGE Cth 2187 (2) BGE Bb 1879 (2),
CRRJM07,gold,à venir,263,[Jean Michel],Somme de l'escripture saincte enseignant la vraye foy. Nouvellement reveue et corrigée,[Anonyme],1539,[Genève],https://gallica.bnf.fr/ark:/12148/bpt6k328613m,Paris BNF Arsenal - 8-T-5341 (1),
CRRJM22,gold,à venir,103,[Jean Michel],Declaration de la messe,Antoine Marcourt,1544,[Genève],https://onb.digital/result/10338742,Vienne NB - 79.H.47,
CRRJM24,gold,à venir,63,[Jean Michel],"Livre des marchans, reveu et augmenté",Antoine Marcourt,1544,[Genève],https://doi.org/10.3931/e-rara-12689,Genève MHR - MHR D Marc 1(44),
CRRJM28,gold,à venir,78,[Jean Michel],"Verité cachée, devant cent ans faicte et composée a six personnages",[Matthieu Malingre?],1544,[Genève],https://doi.org/10.3931/e-rara-12691,Genève MHR - MHR D Mal 1,
CRRJM30,gold,gold,96,[Jean Michel],Faitz de Jesus Christ et du Pape,[Anonyme],[1538/1544],[Genève],https://doi.org/10.3931/e-rara-12688, Genève MHR - MHR K Lut 8 a,
CRRJM33,gold,à venir,96,[Jean Michel],Moralité de la maladie de chrestienté.,[Matthieu Malingre],[1538/1544],[Genève],https://onb.digital/result/103BE0A8,Vienne NB - 48.V.87,
CRRL01,gold,gold,88,[s.n.],Les faitz de Jesus Christ et du Pape,[Anonyme],[ca. 1560],[Lyon],https://luna.manchester.ac.uk/luna/servlet/detail/Manchester~91~1~425957~192597,Manchester UML - R166109,
CRRPV01,gold,gold,415,[Pierre de Vingle],Premiere partie de l'union de plusieurs passaiges de l'escripture saincte. Reveu et corrigé,Herman Bodius,1533,[Genève],https://doi.org/10.3931/e-rara-12757,Genève MHR - MHR K Buc 6(1),
CRRPV02,gold,à venir,364,[Pierre de Vingle],Seconde partie de l'union de plusieurs passaiges de l'escripture saincte. Reveu et corrigé,Herman Bodius,1533,[Genève],https://doi.org/10.3931/e-rara-12758,Genève MHR - MHR K Buc 6(2),
CRRPV03,gold,gold,128,[Pierre de Vingle],Instruction des enfans,[Pierre Robert Olivétan],1533,Genève,https://doi.org/10.3931/e-rara-6933,Genève BGE - BGE Cth 2651 / BGE Bd 1477,
CRRPV04,gold,gold,29,[Pierre de Vingle],"Grans pardons et indulgences, le tresgrand Jubile de plainiere remission",[Anonyme],[1533?],[Genève],https://doi.org/10.3931/e-rara-33167,Neuchâtel BPUN - BPUN A.F. C 30,
CRRPV08,gold,gold,46,[Pierre de Vingle],Livre des marchans,[Antoine Marcourt],1533,[Neuchâtel],https://doi.org/10.3931/e-rara-539,Zurich ZB - Res 1330,
CRRPV09,gold,gold,87,Pierre de Vingle,"Maniere et fasson qu'on tient en baillant le sainct baptesme, et en espousant, et à la saincte Cene",[Guillaume Farel],1533,Neuchâtel,https://doi.org/10.3931/e-rara-5945,Genève BGE - BGE Cth 2649 / BGE Bd 1474,RunningTitleZones à regler
CRRPV11,gold,gold,96,[Pierre de Vingle],"Moralité de la maladie de Chrestienté, a .xiij. personnages",[Matthieu Malingre],1533,[Neuchâtel],https://doi.org/10.3931/e-rara-563,Zurich ZB - Res 1331,
CRRPV12,gold,gold,48,[Pierre de Vingle],Plusieurs belles et bonnes chansons,[Matthieu Malingre],1533,[Neuchâtel],https://doi.org/10.3931/e-rara-6934, Genève BGE - BGE Cth 2650 (1) / BGE Bd 1475 (1),
CRRPV13,gold,gold,48,[Pierre de Vingle],Noelz nouveaulx,[Matthieu Malingre],[1533?],[Neuchâtel],https://doi.org/10.3931/e-rara-577,Zurich ZB - Res 1332,
CRRPV14,gold,à venir,78,[Pierre de Vingle],"Verité cachée, devant cent ans faicte",[Matthieu Malingre?],[1533?],[Neuchâtel],https://onb.digital/result/10816DAF,Vienne NB - 39.Mm.90,
CRRPV16,gold,gold,16,[Pierre de Vingle],Chansons nouvelles demonstrantz plusieurs erreurs et faulsetez,[Matthieu Malingre?],[1534?],[Neuchâtel],https://doi.org/10.3931/e-rara-576,Zurich ZB - Res 1327,
CRRPV19,gold,gold,48,[Pierre de Vingle],"Faictz de Jesus Christ et du Pape : nouvellement reveuz, corrigez, et augmentez",[Anonyme],[1534?],[Neuchâtel],https://gallica.bnf.fr/ark:/12148/bd6t53789915t,Paris BPF - ANDRE 1001,
CRRPV20,gold,gold,1,[Pierre de Vingle],Articles veritables,[Antoine Marcourt],[1534],[Neuchâtel],https://doc.rero.ch/record/20834,Neuchâtel BPUN - BPUN ZQ 143 / BPUN ZU 292,
CRRPV21,gold,gold,78,[Pierre de Vingle],Petit traicte,[Antoine Marcourt],1534,[Neuchâtel],https://dx.doi.org/10.3931/e-rara-6082,Neuchâtel BPUN - BPUN A.F. C 49 D,
CRRPV22,gold,gold,96,[Pierre de Vingle],Declaration de la messe,[Antoine Marcourt],[1534],[Neuchâtel],https://doi.org/10.3931/e-rara-33158,Neuchâtel BPUN - BPUN A.F. C 49 B,
CRRPV23,gold,gold,208,[Pierre de Vingle],Summaire et briefve declaration,[Guillaume Farel],1534,[Neuchâtel],https://doi.org/10.3931/e-rara-5944,Genève BGE -	BGE Cth 2508 / BGE Bc 3379,
CRRPV25,gold,gold,93,[Pierre de Vingle],Letres certaines,[Guillaume Farel],[1534],[Neuchâtel],https://digitale-sammlungen.de/en/view/bsb10194057,Munich SB - Polem. 1608,
CRRS01,gold,à venir,87,[s.n.],Chanson spirituelle sur la saincte cene,[Anonyme],1545,[s.l.],https://doi.org/10.3931/e-rara-120199,Genève BGE - BGE Ctb 4017 BGE Bd 1915,
